{
  "$schema": "../character_spec.schema.json",
  "schema_version": 1,
  "id": "test_hero",
  "name": "Pipeline Test Hero",
  "source": {"mode": "fixture", "path": "../../../client/assets/characters/quaternius/medieval.gltf"},
  "visual": {
    "gender": "female",
    "body_type": "humanoid",
    "height_m": 1.85,
    "style": "stylized low-poly fantasy MOBA fixture",
    "camera_priority": "top_down_readability",
    "prompt": "A deterministic local rigged humanoid fixture used only for pipeline verification"
  },
  "model": {"triangle_target": 50000, "rig": "humanoid", "require_textures": false, "texture_resolution": "2k"},
  "animations": {
    "idle": {"source_name": "Idle", "loop": true},
    "run": {"source_name": "Run", "loop": true},
    "attack_01": {"source_name": "Sword_Slash", "loop": false},
    "hit": {"source_name": "HitRecieve", "loop": false},
    "death": {"source_name": "Death", "loop": false},
    "cast_01": {"source_name": "Punch_Left", "loop": false},
    "cast_02": {"source_name": "Punch_Right", "loop": false},
    "cast_03": {"source_name": "Kick_Left", "loop": false},
    "cast_ultimate": {"source_name": "Kick_Right", "loop": false}
  },
  "gameplay": {"move_speed": 5.0, "attack_range": 2.0, "max_health": 100.0},
  "abilities": [
    {"id": "test_cast", "slot": 0, "animation": "cast_01", "cooldown": 0.0}
  ]
}
