{
  "$schema": "../character_spec.schema.json",
  "schema_version": 1,
  "id": "example_hero",
  "name": "Example Hero",
  "source": {"mode": "meshy_text"},
  "visual": {
    "gender": "male",
    "body_type": "humanoid",
    "height_m": 1.85,
    "style": "stylized fantasy 3D MOBA",
    "camera_priority": "top_down_readability",
    "prompt": "A complete game-ready humanoid fantasy MOBA hero in a clean T-pose, readable silhouette"
  },
  "model": {
    "triangle_target": 50000,
    "rig": "humanoid",
    "require_textures": true,
    "texture_resolution": "2k"
  },
  "animations": {
    "idle": {"motion_prompt": "relaxed combat idle", "duration": 3, "loop": true},
    "run": {"motion_prompt": "forward combat run in place", "duration": 2, "loop": true},
    "attack_01": {"motion_prompt": "fast primary weapon attack", "duration": 2, "loop": false},
    "hit": {"motion_prompt": "short hit reaction", "duration": 2, "loop": false},
    "death": {"motion_prompt": "falling defeated", "duration": 3, "loop": false},
    "cast_01": {"motion_prompt": "quick spell cast", "duration": 2, "loop": false},
    "cast_02": {"motion_prompt": "wide spell cast", "duration": 2, "loop": false},
    "cast_03": {"motion_prompt": "powerful spell cast", "duration": 2.5, "loop": false},
    "cast_ultimate": {"motion_prompt": "dramatic ultimate ability cast", "duration": 3, "loop": false}
  },
  "gameplay": {"move_speed": 5.0, "attack_range": 6.0, "max_health": 1000.0},
  "abilities": []
}
